{
  "schema_version": 1,
  "stage": "plan",
  "action": "fix_and_rerun",
  "issues": [
    {
      "id": "G001",
      "severity": "blocker",
      "summary": "缺少必填章节: ## 范围与写集",
      "root_cause": "plan_gap",
      "criterion_ref": "unified-doc-contract §章节顺序"
    }
  ],
  "next_steps": [
    "修 index.md 必填章节与 write_set 后重跑 gate --post plan"
  ],
  "subject_hash": "99edbc8af142938e",
  "gate_script": "gate-guazi-flow-stage.sh"
}